{
  "$schema": "https://json-schema.org/draft/2020-12/schema",
  "title": "Research Idea",
  "description": "Schema for a research idea generated by the ideation phase",
  "type": "object",
  "required": ["Name", "Title", "Short Hypothesis", "Related Work", "Abstract", "Experiments", "Risk Factors and Limitations"],
  "properties": {
    "Name": {
      "type": "string",
      "description": "Short snake_case identifier for the idea"
    },
    "Title": {
      "type": "string",
      "description": "Publication-ready paper title"
    },
    "Short Hypothesis": {
      "type": "string",
      "description": "One-sentence hypothesis statement"
    },
    "Related Work": {
      "type": "string",
      "description": "How this idea differs from prior work"
    },
    "Abstract": {
      "type": "string",
      "description": "Conference-style abstract (~250 words)"
    },
    "Experiments": {
      "type": "array",
      "items": { "type": "string" },
      "description": "List of specific experiments to run"
    },
    "Risk Factors and Limitations": {
      "type": "array",
      "items": { "type": "string" },
      "description": "Known risks and limitations of the approach"
    }
  }
}
